PubmedID,Title,Publication Date,Non-academicAuthor(s),CompanyAffiliation(s),Corresponding Author Email
40658149,Identification Cuproptosis-related Genes Signature to Predict the Prognosis of Lung Cancer.,2025,Guannan Wang,"Department of Pharmaceutical, The Affiliated Xuzhou Municipal Hospital of Xuzhou Medical University, Xuzhou, Jiangsu, China. 17712982016@163.com.",17712982016@163.com.
40658038,Assessing the influence of male vaccination on cervical cancer elimination in China under different vaccination coverage scenarios: A modeling study.,2025,Ibrahim Diakite; Jeffrey Kyle; Sujian Situ; Wei Vivian Wang; Xingxing Zhang; Yin Wang; Rui Bian; Hai Bin Wu; Xu Sheng Wang; Ya-Ting Chen; Vincent Daniels,"MRL Global Medical Affairs, MSD China Holding Co., Ltd., Shanghai, China.; Outcomes Research, Merck & Co., Inc., Rahway, NJ, USA.; Health Economic and Decision Sciences, Merck & Co., Inc., Rahway, NJ, USA.; Health Economics and Outcomes Research, MSD China Holding Co., Ltd., Shanghai, China.",Not available
40656593,Editorial: Screening and discovering novel biological biomarkers by omic-data to revolutionize tumor management.,2025,Enrique Medina-Acosta,"Laboratory of Biotechnology, Center for Bioscience and Biotechnology, State University of North Fluminense, Campos dos Goytacazes, RJ, Brazil.",Not available
40656384,Immunogenic Cell Death as a Target for Combination Therapies in Solid Tumors: A Systematic Review Toward a New Paradigm in Immuno-Oncology.,2025,Imad Barjij,"Department of Medical Oncology, Faculty of Medicine and Pharmacy of Rabat, National Institute of Oncology, Ibn Sina University Hospital, Mohammed V University, Rabat, MAR.",Not available
40655858,"Molecular Docking, Molecular Dynamics Simulation, and Pharmacophore-Based Virtual Screening Unveil Natural Compounds with TIM-3 Inhibitory Activity.",2025,Abdulrahim A Alzain; Mohammed A Almogaddam; Rayan Yousif; Mohammed Hamed Alqarni; Ahmed I Foudah; Wadah Osman; Khaled M Elamin; Ehssan Moglad; Ahmed Ashour; Reham M Samra; Gamal A Mohamed,"Department of Pharmaceutical Chemistry, Faculty of Pharmacy, University of Gezira, Wad Madani 21111, Sudan.; Department of Pharmacognosy, Faculty of Pharmacy, Mansoura University, Mansoura 35516, Egypt.; Department of Natural Products and Alternative Medicine, Faculty of Pharmacy, King Abdulaziz University, Jeddah, 21589, Saudi Arabia.; Department of Pharmacognosy, Faculty of Pharmacy, Prince Sattam Bin Abdulaziz University, Al-kharj 11942, Saudi Arabia.; Department of Pharmaceutics, Faculty of Pharmacy, Prince Sattam Bin Abdulaziz University, Al-kharj 11942, Saudi Arabia.; Graduate School of Pharmaceutical Sciences, Kumamoto University, 5-1 Oe-honmachi, Chuo-ku, Kumamoto 862-0973.",Not available
